"To kill a Linux process, you can use the `kill`command followed by the process ID (PID)"
"of the process you want to terminate. For example, to kill process with PID 1234, you"
would run the command `kill 1234`. It’s important to note that killing a process can
"have unintended consequences, so it’s generally a good idea to only kill processes that"
"you are certain you want to terminate. Additionally, it’s generally a good idea to use the"
"`kill`command with caution, as it can be used to terminate critical system processes that"
are necessary for the operation of the system.
